,username,description,profileUrl,location,website
1191,melaniewho,"gospel music multi-media girl, ceo&founder of gospelflava.com, stellar award nominated drive-time host Praise 100.9,wife,mommy,lover of God,good food&fly shoes!",https://twitter.com/melaniewho,"Charlotte,NC",
1192,StewartHaasRcng,"Stewart-Haas Racing is the title-winning NASCAR team co-owned by @TonyStewart and Gene Haas, founder of @Haas_Automation.",https://twitter.com/StewartHaasRcng,"Charlotte,NC",http://www.stewarthaasracing.com
1193,ThomasDavisSDTM,"Love God, Love my family, Love my life; Founder of @tdddf, UGA Alum, Former Carolina Panther, Former LA Charger, Former Washington Football Teamer!",https://twitter.com/ThomasDavisSDTM,"Charlotte,NC",
1194,INDIEbusiness,Insurance for Makers. Coaching + resources to help you grow a profitable business and enjoy success on your own terms. #joinindiebusiness Founder: @donnamaria,https://twitter.com/INDIEbusiness,"Charlotte,NC",https://www.indiebusinessnetwork.com/join
1195,MsBiancaAK,Mom. World Record Holder. Olympian. World Champion. Hook 'Em. Mississippi. Dream BIG. #BKTrackStars CEO: @bktrackstars Founder: @bkfgives IG: MsBiancaAK,https://twitter.com/MsBiancaAK,"Charlotte,NC",http://www.bkfgives.org
1196,maxpapis,"DOUBLE Daytona 24H Winner, IMSA Champion,NASCAR,CART, Le Mans, INDY500, F. Monza , M+M dad TP hubby @mpi_innovations founder OPINION R MY OWN",https://twitter.com/maxpapis,"Charlotte,NC",http://www.maxpapis.com
1197,DougHerbert,"Doug Herbert @NHRA top fuel Racer, 4x Top Fuel Champion, Founder of @putonthebrakes Charity 501(c)(3) in memory of my sons Jon & James",https://twitter.com/DougHerbert,"Charlotte,NC",http://www.dougherbert.com
1198,CandiceNicolePR,"Founder & CEO of CNPR | 🏆 Award-Winning Publicist | Speaker, Podcast Host, Connector & Media Maven | Creator of Respect The Publicist",https://twitter.com/CandiceNicolePR,"Charlotte,NC",http://www.candicenicolepr.com
1199,Jouelzy,1913🔺| Black Feminist on @YouTube. Book Club Founder @smartbrowngirls. Public History grad student.,https://twitter.com/Jouelzy,"Charlotte,NC",http://www.youtube.com/jouelzy
1200,kcerminara,"Founder @FGFundamental Fundamental Global w) @CoachJoeMoglia | Chairman $FGH, $FGF, $BKTI | SPACs: $FGNA, $ADF, $FGMC, $FGAA | bit.ly/FG20Di",https://twitter.com/kcerminara,"Charlotte,NC",https://www.linkedin.com/in/kyle-cerminara-fundamental-global-investors
1201,pepman704,"Founder - CFI. Former Coach @ Harding, Myers Park, & Waddell HS. Partner of the QC Senior Bowl. Nationally credited on CNN & Sp. News. Prep RedZone Contributor",https://twitter.com/pepman704,"Charlotte,NC",http://charlottefootballinsiders.com
1202,GregAtkinson,Author | Speaker | Entrepreneur | Guest Services & Leadership Consultant. Mental health ❤️ Founder: First Impressions Conference. linktr.ee/gregatkinson,https://twitter.com/GregAtkinson,"Charlotte,NC",http://gregatkinson.com/
1203,CharlotteBSB,2022 NCAA Leader BB p/Game Offensively (6.40) • 3 2022 MLB Draft Picks • 2021 CUSA Champs • 2021 NCAA At-Large • 9x Conf Champs • 6x NCAA • #9ATC,https://twitter.com/CharlotteBSB,"Charlotte,NC",http://www.charlotte49ers.com/schedule.aspx?path=baseball
1204,LonghornChassis,For more than 10 years Longhorn Chassis has been a leader in Modified and Late Model chassis manufacturing.,https://twitter.com/LonghornChassis,"Charlotte,NC",https://linktr.ee/LonghornChassis
1205,wfnz,Sports Radio WFNZ. Charlotte’s Sports Leader 92.7 FM or the WFNZ mobile app. Follow: @macwfnz @TBoneWFNZ @wesgotrange @walkermehl @KyleBaileyClub,https://twitter.com/wfnz,"Charlotte,NC",https://wfnz.com
1206,cassandraoneal,Minister. International Recording Artist. Worship Leader. Consultant. Bilingüe Me sigues Te sigo 704-287-6998 or onthemark84@gmail.com,https://twitter.com/cassandraoneal,"Charlotte,NC",http://www.cassandraonealministries.com
1207,ILLUMANINETY,Current @xflrenegades Former @nyjets @chiefs @buffalobills @jaguars NFL ➡️ Software Dev.,https://twitter.com/ILLUMANINETY,"Charlotte,NC",
1208,chadknaus,Full-time Dad | 7x #NASCAR champion crew chief | VP of competition @TeamHendrick | @FOXSports and @IMSA part-timer,https://twitter.com/chadknaus,"Charlotte,NC",http://www.HendrickMotorsports.com
1209,RoyLMattox,Chief Market Strategist and Portfolio Manager. Tweets are opinions and not investment advice.  Zetetic Cognoscente and acolyte of William O'Neil.,https://twitter.com/RoyLMattox,"Charlotte,NC",http://www.ifsinvest.com
1210,EricThomasWx,Retired Chief Meteorologist WBTV,https://twitter.com/EricThomasWx,"Charlotte,NC",https://3dvrwalkthrough.com/
1211,_BurtWhite,"Chief Strategy Officer of @CarsonGroupLLC; On a Noble Quest to Help You Find Your Freedom!
Advisory services through CWM, LLC, Registered Investment Advisor.",https://twitter.com/_BurtWhite,"Charlotte,NC",http://carsongroup.com
1212,alancarroII,Chief Degen: @Hashflow Previously: @Vayner3 ⚙️@UnumGame⚙️Opinions are my own,https://twitter.com/alancarroII,"Charlotte,NC",
1213,RasuShrestha,"Bridge builder & strategist. EVP, Chief Innovation & Commercialization Officer. In pursuit of person-centered value-based intelligent health & care.",https://twitter.com/RasuShrestha,"Charlotte,NC",https://www.advocatehealth.org/about/leadership/rasu-b-shrestha
1214,wxbrad,"Chief Meteorologist @wcnc WCNC Charlotte, Weather & Science Geek! Cleveland & Charlotte Sports Fan & proud @OhioState grad. wcnc.com/weather #cltwx #ncwx #scwx",https://twitter.com/wxbrad,"Charlotte,NC",https://www.wcnc.com/weather
1215,WinstonKelley,"@NASCARHall Executive Director; (Retired) @MRNRadio Pit Reporter; Elaine’s husband, “GDub” to Annabelle & Trevor; Enjoy #BlowingRockNC & my @HarleyDavidson",https://twitter.com/WinstonKelley,"Charlotte,NC",http://www.nascarhall.com
1216,MikeDavis88,President & Executive Producer @DirtyMoMedia | Creator of content | Co-creator of 2 Davis daughters | Hater of tomatoes | Lover of ketchup,https://twitter.com/MikeDavis88,"Charlotte,NC",http://DirtyMoMedia.com
1217,nephondemand,"Physician-executive and kidney doctor | Ex-Nephrology PD | @NODanalytics, NephTwitterArchive.com, NephroWorldCup.com creator | Tweets my own | LI: @nephondemand",https://twitter.com/nephondemand,"Charlotte,NC",https://goo.gl/mfziXG
1218,LeonardWheeler7,"Former NFL Player, Personal & Executive Coach, Speaker, NFL CO-Executive Director, NFL Transitions Coach, Author of Beyond the Locker Room, Husband & Proud Dad",https://twitter.com/LeonardWheeler7,"Charlotte,NC",http://www.LeonardWheeler.com
1219,Drinspiration1,"Dr. Tommy A. Watson - successful entreprenuer: author, speaker, executive and professional coach, consultant and investor. From homeless to Dr.",https://twitter.com/Drinspiration1,"Charlotte,NC",http://Www.drtommyepk.com
1220,emilyfranESL,ESL teacher🕷| Author of #IfUonlyKnewBook | '16 @CabCoSchools Teacher of the Year | Executive Board member for @carolinaTESOL | My tweets,https://twitter.com/emilyfranESL,"Charlotte,NC",https://linktr.ee/Mrs.FrancisESL
1221,WFAE,Local news and conversations from journalists in the Charlotte area. Home to @NPR news and @CharlotteTalks.,https://twitter.com/WFAE,"Charlotte,NC",http://WFAE.org
1222,MattWeaverRA,Free Agent Motorsports Journalist! Never apologize for living.,https://twitter.com/MattWeaverRA,"Charlotte,NC",
1223,HeatherChilders,"Proud American, Journalist, Catch me filling in here & there, @FoxNews Anchor for 10 years, Launched & Anchored Two #1 Rated Shows for @FoxNews, Carolina Girl",https://twitter.com/HeatherChilders,"Charlotte,NC",http://www.linkedin.com/in/heather-childers-9814174
1224,Sean_OConnell,"Journalist. Managing Editor for @CinemaBlend. Co-host of @ReelBlend. Author of @RTSCBook, @WGreatPowerBook, and the upcoming Bruce Willis book, UNBREAKABLE.",https://twitter.com/Sean_OConnell,"Charlotte,NC",https://www.cinemablend.com/
1225,AlanCavanna,Motorsports Reporter #NASCAR / A Connecticut Yankee in King Richard's court / Journalist and TV lover / Proud 🍊/ @posregpod alum,https://twitter.com/AlanCavanna,"Charlotte,NC",http://www.youtube.com/AlanCavannaMedia
1226,Maddie_Gardner,Corporate communicator. Former journalist. Tar Heel. Lover of exercise & cake.,https://twitter.com/Maddie_Gardner,"Charlotte,NC",http://www.facebook.com/maddiegardnernews
1227,BrigidaMack,Wife. Believer. Journalist.,https://twitter.com/BrigidaMack,"Charlotte,NC",https://linktr.ee/brigidamack
1228,Floramujaasi,Journalist | MSc #Pop @LSEnews #God #DementiaFriend #SRHR #MenstruationMatters #Env #Digitalmarketing #Arsenal 💚No BS🙅🏾‍♀️ #Uganda SB's🌼 @inourworldafj,https://twitter.com/Floramujaasi,"Charlotte,NC",http://florenceblondel.com
1229,StorytellerSBM,Journalist & Soldier. Just not at the same time. Formerly @AP - now freelance. Mrs. @NickOchsnerWBTV. #MMJane creator. 8x Emmy loser. Aspiring Arabic speaker.,https://twitter.com/StorytellerSBM,"Charlotte,NC",https://interpretingfreedom.org/#support
1230,KevinHarvick,• NASCAR Driver • DeLana’s Husband • Keelan & Piper’s Dad • President & Co-founder of @khimanagement and @thekhfoundation •,https://twitter.com/KevinHarvick,"Charlotte,NC",http://www.kevinharvick.com
1231,Coach_Rick57,"President, Phenom Hoops; Sports Correspondence, Charlotte Observer, News & Observer; Voting Member, Spalding All-American Committee",https://twitter.com/Coach_Rick57,"Charlotte,NC",http://www.phenomhoopreport.com
1232,ralphsheheen,"Sportscaster for FOX Sports, CBS Sports, NBC Sports & MAVTV. Owner and President of SPEED SPORT. Married to Kimberly proud Dad of Olivia & Lucas!",https://twitter.com/ralphsheheen,"Charlotte,NC",http://www.speedsport.com
1233,roushyates,Building power under the hood for @FordPerformance. 🐎💪 | President and CEO @Yates_Doug,https://twitter.com/roushyates,"Charlotte,NC",https://roushyates.com/
1234,WarrenColeSmith,"President, MinistryWatch.com; author of 10 books:  Faith-Based Fraud, Restoring All Things, A Lover's Quarrel with the Evangelical Church, Prodigal Press, etc.",https://twitter.com/WarrenColeSmith,"Charlotte,NC",http://www.ministrywatch.com
1235,JoeCongelAuthor,Author of the Tony Razzolito PI Detective novels // short stories // cartoonist 📝 //#WritingCommunity #WolfPackAuthors joecongelfictionstories.blogspot.com,https://twitter.com/JoeCongelAuthor,"Charlotte,NC",http://amazon.com/author/joecongel
1236,AuthorTRobare,Author. Writing Arts degree. Hopefully changing a life or two. Fantasy and poetry. Native American Indian. Author of God and the 12 Knights,https://twitter.com/AuthorTRobare,"Charlotte,NC",https://www.amazon.com/Loving-Her-cant-Learned-Elizabeth/dp/B08VVCQ3DH/ref=mp_s_a_1_3?crid=2VH4STW3X
1237,JacksonLahmeyer,Husband | Father | Pastor of Sheridan.Church | Founder Pastors4Trump.com,https://twitter.com/JacksonLahmeyer,"Tulsa,OK",http://www.jacksonlahmeyer.com
1238,mikehenrysr,"Founder & Visionary of Follower of One @followerofone1 Elevate Purpose, Mobilize People, Ignite Change

#Leadership #Christian #marketplaceministry #podcast",https://twitter.com/mikehenrysr,"Tulsa,OK",https://followerofone.org
1239,newson6wxguy,"Chief Meteorologist at KOTV the News on 6, Tulsa, OK.",https://twitter.com/newson6wxguy,"Tulsa,OK",http://www.newson6.com
1240,MikeCollierWX,KJRH Chief Meteorologist #Tulsa. Father of three. Tulsa Native.,https://twitter.com/MikeCollierWX,"Tulsa,OK",http://www.facebook.com/MikeCollierWX
1241,TedGenoways,@BeardFoundation award winner. Book on tequila coming from @wwnorton. Words: @MotherJones & @newrepublic. President's Professor of Media Studies at @utulsa.,https://twitter.com/TedGenoways,"Tulsa,OK",https://www.tedgenoways.com/
1242,joshpeak,"President of Peak Enterprises, Inc. 
Entrepreneur|Podcast Host|Mobile Media|Online Advertising|App Development|Startup Catalyst",https://twitter.com/joshpeak,"Tulsa,OK",http://www.joshpeak.com
1243,davidburkus,Helping Teams Do Their Best Work Ever | Bestselling Author | Keynote Speaker | Organizational Psychologist,https://twitter.com/davidburkus,"Tulsa,OK",https://davidburkus.com/social
1244,barryraeburn,Evangelist and author. Sign up for newsletter at: barryraeburn.org/media/articles… Facebook at: tinyurl.com/nt4u88g,https://twitter.com/barryraeburn,"Tulsa,OK",http://www.barryraeburn.org
1245,darrynzewalk,"composer,singer-songwriter, author, podcast host bringing encouragement to the listening soul linktr.ee/darrynzewalk",https://twitter.com/darrynzewalk,"Tulsa,OK",https://linktr.ee/darrynzewalk
1246,nicholenordeman,songwriter. singer. author. prone to wander. profoundly indebted.,https://twitter.com/nicholenordeman,"Tulsa,OK",https://youtu.be/-JDSSUyENd8
1247,59NationalParks,"Travel Photography Adventure and Fun Co-host of #ParkChat Author of our upcoming book ""Chasing the Horizon"" for our 59 National Park journey As seen on @CNN 🦬",https://twitter.com/59NationalParks,"Tulsa,OK",http://www.59nationalparks.com
1248,roddywhiteTV,"All Pro Wide Receiver, The Excellence of Execution, Car Enthusiast and founder of Keep The Faith Foundation",https://twitter.com/roddywhiteTV,"Charleston,SC",http://www.roddywhite.TV
1249,terracecrawford,Digital Creator. Consultant. Jesus Follower. Friend. Founder @HireASidekick,https://twitter.com/terracecrawford,"Charleston,SC",https://www.hireasidekick.com
1250,drdennisschimpf,Author of Finding Beauty | Speaker | Double Board Certified Plastic Surgeon | Founder @sweetgrasssurge sweetgrassplasticsurgery.com #PlasticSurgery #MedSpa,https://twitter.com/drdennisschimpf,"Charleston,SC",
1251,Live5News,The Lowcountry's News Leader. Everywhere You Are. Get the latest Lowcountry updates through our apps live5news.com/downloadlive5n…,https://twitter.com/Live5News,"Charleston,SC",http://www.live5news.com
1252,ABCNews4,"ABC News 4, the leader in news, sports and information for Charleston and the Lowcountry.",https://twitter.com/ABCNews4,"Charleston,SC",https://abcnews4.com/
1253,karringtonsc,Servant Leader. Conservative Republican.,https://twitter.com/karringtonsc,"Charleston,SC",
1254,micahspruill,MP & Chief Investment Officer | Trading magic internet money since 2014.,https://twitter.com/micahspruill,"Charleston,SC",https://s2fcapital.com
1255,LeeSmithDC,Author and columnist LEESMITH462@protonmail.com,https://twitter.com/LeeSmithDC,"Charleston,SC",https://www.centerstreet.com/titles/lee-smith/the-permanent-coup/9781546059547/
1256,JoeEhrmann76,"President of InSideOut Team, Author of InSideOut Coaching, subject of Season of Life, Tedx ‘Be a Man’, ex NFL",https://twitter.com/JoeEhrmann76,"Charleston,SC",
1257,KLF,Press Secretary for @NikkiHaley for President. Former Capitol Hill and POTUS spox. Proud @NCState and @Georgetown alum; prouder first-generation American.,https://twitter.com/KLF,"Charleston,SC",
1258,Storiad,"@Storiad is Author Freedom, Author Control, Author Agency. Get started for free. storiad.com #WritingCommunity #Authors #BookMarketing #amwriting",https://twitter.com/Storiad,"Charleston,SC",https://storiad.com/
1259,kathrynbudig,Co-host of Free Cookies Podcast ★ author of Aim True ★ teacher ★ recipe writer ★ Dog lover. Subscribe to our podcast: tinyurl.com/ycf4a9hx,https://twitter.com/kathrynbudig,"Charleston,SC",http://www.kathrynbudig.com
1260,taylorsschumann,Wife | Mom | Author of When Thoughts and Prayers Aren't Enough from @ivpress | bylines @readersdigest @sojourners @ctmagazine @narratively @plough.,https://twitter.com/taylorsschumann,"Charleston,SC",http://www.taylorschumann.com
1261,BublishMe,"A complete #book #publishing and #marketing solution for professional #indie #authors. Learn more: linktr.ee/bublishme
#selfpublishingrocks Ck out a #bookbubble",https://twitter.com/BublishMe,"Charleston,SC",https://www.bublish.com/
1262,MaribelLopez,"#Speaker, #author, #podcast host #edgecomputing #mobile #AI #IIOT #edge #futureofwork #cloud #CCaaS contributor to @Forbes.com",https://twitter.com/MaribelLopez,"Charleston,SC",http://www.lopezresearch.com
1263,csingleton__2,"Inspirational Keynote Speaker & Best Selling Author featured on @e60, @usatoday, @todayshow, @sinow, etc... | Former Pro Ballplayer ⚾️ |",https://twitter.com/csingleton__2,"Charleston,SC",https://linktr.ee/csingleton2
1264,dcaraviello,"Author, ""Hidden History of Gamecocks Football.” Real estate for @PostandCourier, strategy for @bookies, sponsored for @AJC and more. Need content? I can help.",https://twitter.com/dcaraviello,"Charleston,SC",https://www.amazon.com/Hidden-History-Gamecocks-Football-Sports/dp/1467143316/ref=nodl_
1265,christinenolfi,Author of heartwarming and inspiring fiction. Represented by The Knight Agency.,https://twitter.com/christinenolfi,"Charleston,SC",http://www.christinenolfi.com
1266,DonnerKay,"Truth to power, always. DM tips. Editor, Co-founder, CEO: @msfreepress, @jxnfreepress @msyouthmedia • she/her • my tweets, my views",https://twitter.com/DonnerKay,"Memphis,TN",http://mississippifreepress.org
1267,TCMLLC,"Growth stock investor focused on finding the next SUPER WINNERS. 25 years experience, life long student, and founder of TickerMonkey.com traders chat community.",https://twitter.com/TCMLLC,"Memphis,TN",http://www.tickermonkey.com
1268,ZacharyAtkins77,Founder @MemphianL StockMarket & Crypto Investor #Bitcoin #Ethereum #AVAX #CRO #BNB #Litecoin #Solana #NFTs #Web3 #AI #LUNC 🐋 Follow My Hashtag #MemphianDollar,https://twitter.com/ZacharyAtkins77,"Memphis,TN",https://www.facebook.com/ZacharyAAtkins7
1269,benadkins,Founder at Serial Progress Seeker,https://twitter.com/benadkins,"Memphis,TN",http://www.serialprogressseeker.com
1270,AndyWise5,Andy Wise is the founder and consumer investigator of Wise Choices™️. He does the work for you in vetting the best Mid-South businesses for consumer protection.,https://twitter.com/AndyWise5,"Memphis,TN",http://www.andywisechoices.com
1271,Kontji,"Tech Founder. I 💕 dogs, Memphis, HowardU, sci-fi, time travel, karaoke, tennis, billiards, lattes, salmon.",https://twitter.com/Kontji,"Memphis,TN",https://www.getyoudle.com
1272,katinarankin,"I trust God! Emmy nominated journalist, Children’s Author, Founder of nonprofit — Katina’s Klassroom, AKA.",https://twitter.com/katinarankin,"Memphis,TN",http://katinasklassroom.com
1273,memphisnews,"The official Twitter account of Memphis' news leader, The Commercial Appeal.",https://twitter.com/memphisnews,"Memphis,TN",http://www.commercialappeal.com
1274,DucksUnlimited,• World's leader in wetlands conservation • Over 15 million acres conserved • The Official Account of Ducks Unlimited Inc.,https://twitter.com/DucksUnlimited,"Memphis,TN",http://www.ducks.org
1275,COMPCams,"COMP Cams is the ""Absolute Leader In Valve Train Technology"" making superior camshafts, valve train components and performance engine parts. 🇺🇸 #NoCOMParison",https://twitter.com/COMPCams,"Memphis,TN",http://www.compcams.com
1276,assumptionprime,"Level 34 Cartoonist, Pokémon Gym Leader, Level 90 GNB/SAM. Elden Lord. She/Her Commissions are closed.",https://twitter.com/assumptionprime,"Memphis,TN",http://patreon.com/RobinBrooks
1277,VarsitySpirit,"The Official Twitter of Varsity Spirit, the leader in cheerleading & dance camps, competitions & uniforms.",https://twitter.com/VarsitySpirit,"Memphis,TN",http://varsity.com
1278,MemphisChamber,"The voice of Memphis business since 1838, we are the region’s economic development leader & an advocate of prosperity for all. #MovingMemphisForward",https://twitter.com/MemphisChamber,"Memphis,TN",https://memphischamber.com
1279,treysmith,"GOD FIRST | Kansas City Chiefs OL | Proud Tennessee Volunteer 🍊| For marketing, PR, & business inquiries: @b2bradtke | Instagram: trey_smith",https://twitter.com/treysmith,"Memphis,TN",
1280,45SaveAmerica,Journalist @rsbn @foxnews @oann @tuckercarlson,https://twitter.com/45SaveAmerica,"Memphis,TN",
1281,calebparke,Writer. Journalist. Editor. Fox News alum. born and raised in Ohio. Love sharing #GoodNews,https://twitter.com/calebparke,"Memphis,TN",http://calebparke.com
1282,Mearlonfox13,"Peabody, 8 Emmy, Murrow award winning journalist seen weeknights 5, 9 & 10 on FOX13 News. Reported & anchored in NC, TN, MS and CT.",https://twitter.com/Mearlonfox13,"Memphis,TN",http://www.myfoxmemphis.com
1283,wendi_c_thomas,Journalist. Disrupter. @MLK50Memphis editor. Former @ProPublica LRN Fellow. 2020 Selden Ring winner. @niemanfdn c/o '16. DMs open. She/her #1908 💕💚,https://twitter.com/wendi_c_thomas,"Memphis,TN",http://mlk50.com
1284,ErnieFox13,"News Anchor, 4 time Emmy Award winning Journalist.  Michigan State University Alum.",https://twitter.com/ErnieFox13,"Memphis,TN",http://www.fox13memphis.com
1285,UofMPastPres,"Distinguished U Professor of Psychology Rudd Institute for Veteran & Military Suicide Prevention Former President, U of M
ruddinstitute.memphis.edu",https://twitter.com/UofMPastPres,"Memphis,TN",
1286,AliceMarieFree,Grandmother | Author | Criminal Justice Advocate | Granted Clemency by President @realDonaldTrump after 21 Years in Prison,https://twitter.com/AliceMarieFree,"Memphis,TN",http://www.takingactionforgood.org
1287,TommyJoeMartins,Back to Back 20th Best @XfinityRacing Driver. President @TeamAlphaPrime. @OleMiss Rebel.,https://twitter.com/TommyJoeMartins,"Memphis,TN",http://tommyjoemartins.com
1288,ArceneauxHayley,PA 🩺 Astronaut 🧑‍🚀 Speaker 🎤 Traveler 🌎 Author ✍️ of Wild Ride. For inquiries email s.park@bep-la.com 💕,https://twitter.com/ArceneauxHayley,"Memphis,TN",https://www.penguinrandomhouse.com/books/712670/wild-ride-by-hayley-arceneaux/
1289,BishopPorter,"Int'l Preacher, Motivational Speaker, Author, Recording Artist, Pastor - Greater Community Temple COGIC, Prelate of TN Central, General Board - 6M member COGIC",https://twitter.com/BishopPorter,"Memphis,TN",http://www.gctministries.org
1290,MaxxChewning,Owner/Founder @sourstripscandy. I make really cool YouTube videos and have a cute Goldendoodle,https://twitter.com/MaxxChewning,"Houston,TX",http://www.youtube.com/maxxchewning
1291,FredCuellar,"Founder/CEO Of Diamond Cutters International, Author, Inventor, Executive Coach, Motivational Speaker, Grateful DiamondCuttersIntl.com",https://twitter.com/FredCuellar,"Houston,TX",
1292,TheDamaniFelder,"Founder of YouTube's The Right Brothers. MAGA. Gig 'Em. Texas A&M  '14. If God is for us, who can be against us? Opinions are my own. #IdentityPoliticsIsDead",https://twitter.com/TheDamaniFelder,"Houston,TX",https://linktr.ee/TheRightBrothers
1293,BookerT5x,"The Official Account of 2X WWE Hall of Famer, 35X Wrestling Champion and Founder of @TheOfficialROW, Booker T.",https://twitter.com/BookerT5x,"Houston,TX",http://realityofwrestling.com
1294,FranklinChangD,Founder of Ad Astra Rocket Company || NASA Astronaut for a record 7 space missions,https://twitter.com/FranklinChangD,"Houston,TX",http://www.adastrarocket.com/
1295,ItsMooseCraft,Making #MooseMovies 🍿🎥🎬 | Founder of 100Media | Business: MooseCraftContact@gmail.com,https://twitter.com/ItsMooseCraft,"Houston,TX",https://youtube.com/c/itsmoosecraft
1296,MattressMack,"Jim Mattress Mack McIngvale. · Founder of Gallery Furniture, hard work enthusiast! · If it is to be, it is up to me!",https://twitter.com/MattressMack,"Houston,TX",http://www.galleryfurniture.com
1297,ArtOnBlockchain,Founder of @artblocks_io. Creator of the Squiggle. Art + Blockchains keep me busy. Shoutout to @larvalabs for lighting the fuse.,https://twitter.com/ArtOnBlockchain,"Houston,TX",https://artblocks.io
1298,NexpoYT,Internet detective • Founder of @LiminalLand🎡 • 1/2 of @NickandRyan📹,https://twitter.com/NexpoYT,"Houston,TX",https://liminalland.net
1299,A2KDeFi,Founder & CPO @exchgART @CodeCanvas_Art | 🥐 | Cross Chain Maxi,https://twitter.com/A2KDeFi,"Houston,TX",https://aether.so/space/46ab8afb-9e7a-47dc-b87f-d162b645a912
1300,TonyNashNerd,Founder of AI firm Complete Intelligence: completeintel.com. Former The Economist & IHS Markit. My hobby is NerdRoaster (nerdroaster.co). Misophoniac.,https://twitter.com/TonyNashNerd,"Houston,TX",http://www.linkedin.com/in/tonynash
1301,CrystalEchoHawk,Pawnee. Founder & Executive Director @IllumiNative. Views are my own. #IllumiNative #NativeRepresentation #FightInvisibility #SmashStereotypes #NativesVote,https://twitter.com/CrystalEchoHawk,"Houston,TX",https://illuminatives.org/
1302,ChrisMakara,"Digital Marketing Strategist & @Bulkly Founder [bulk.ly] - Ambidextrous bowler skilled in #SEO, #SocialMedia, #Automation & #Analytics. 🍧🎳🏈",https://twitter.com/ChrisMakara,"Houston,TX",http://chrismakara.com/about
1303,timgodfreyworld,Singer| SongWriter| Producer| Speaker| Philanthropist |Catalyst |Music Director | Leader & Founder of ROXNATION; Nigeria’s Finest Kingdom Group!,https://twitter.com/timgodfreyworld,"Houston,TX",https://timgodfrey.lnk.to/AlreadyWon
1304,FullyRaw,"Kristina Carrillo-Bucaram is FullyRaw. Raw vegan health advocate for 15+ years, she is the founder of Rawfully Organic, nation's largest produce co-operative.✌️",https://twitter.com/FullyRaw,"Houston,TX",http://www.fullyraw.com
1305,7Innovator,Founder & CEO @7investing. Empowering you to invest in your future. UT Longhorn + Rice Owl. Previously advisor @themotleyfool + VC @chevron,https://twitter.com/7Innovator,"Houston,TX",http://www.7investing.com/subscribe
1306,pickeringenergy,"Founder, Chief Investment Officer of Pickering Energy Partners...comments are not investment advice",https://twitter.com/pickeringenergy,"Houston,TX",http://www.pickeringenergypartners.com
1307,DBrozeLiveFree,"Houston Mayoral Candidate - Running to Expose Corruption. Journalist,  Film Maker, Author, Agorist Activist, Founder The Conscious Resistance Network.",https://twitter.com/DBrozeLiveFree,"Houston,TX",https://www.derrickbroze.com/
