,username,description,profileUrl,location,website
843,MattEddyBA,"@BaseballAmerica executive editor 
⚾️ Prospect analysis and MLB insight 
⚾️ A few answers. A lot of questions. 
⚾️ Follow me on Post: matteddyba",https://twitter.com/MattEddyBA,"Raleigh,NC",https://www.baseballamerica.com/about-ba/authors/matt-eddy
844,ScottEblin,"Leadership Expert, Global Speaker, Best Selling Author, Executive Coach. instagram.com/scotteblin/",https://twitter.com/ScottEblin,"Raleigh,NC",http://www.eblingroup.com/blog
845,zshirwac1,"Somali American. Former GSD Executive Director. Activist: Civil, Religious, Voting rights. Fighting bigotry. Gardener In-progression .",https://twitter.com/zshirwac1,"Raleigh,NC",http://gsd.org.uk/
846,ImaCeliac,"I rock the Gluten Free lifestyle because I have Celiac Disease and no, I'm not contagious. Author, Food Blogger, Business Executive #girlboss",https://twitter.com/ImaCeliac,"Raleigh,NC",http://www.imaceliac.com
847,JoshStein_,"Running for Governor to fight for NC’s future. Currently AG of NC. Husband of Anna and dad of Sam, Adam & Leah.",https://twitter.com/JoshStein_,"Raleigh,NC",http://www.joshstein.org
848,PatMcCroryNC,"74th Governor of North Carolina. Conservative Leadership Built in North Carolina, Not Washington. Candidate for US Senate.",https://twitter.com/PatMcCroryNC,"Raleigh,NC",http://patmccrory.com
849,LtGovDanForest,The official page for Lt. Governor Dan Forest.,https://twitter.com/LtGovDanForest,"Raleigh,NC",
850,WastedFood,"Wasted Food Dude, journalist, speaker, consultant, leftover lover, food waste hater.",https://twitter.com/WastedFood,"Raleigh,NC",http://www.wastedfood.com
851,ericfish85,"Journalist, author. Write on youth, protest, activism, politics, education related to China. Bylines in @ForeignPolicy @TheAtlantic @TIME @SCMPNews @Telegraph",https://twitter.com/ericfish85,"Raleigh,NC",https://chinasmillennials.com/
852,TimBoyumTV,4x Emmy Award-Winning Journalist on Spectrum News 1 in NC. Nightly: @nccaptonight #ncpol Weekly: Tying It Together #podcast Monthly: Front Porch Politics,https://twitter.com/TimBoyumTV,"Raleigh,NC",http://spectrumlocalnews.com/nc/triangle-sandhills/anchors/2017/11/17/tim-boyum
853,sara__pequeno,opinion journalist based in Durham trying to write from a place of love ❤️‍🔥⚖️ she/they,https://twitter.com/sara__pequeno,"Raleigh,NC",https://www.newsobserver.com/profile/253685443
854,jdgreear,"Pastor of @SummitRDU. Husband to Veronica, dad of Kharis, Allie, Ryah and Adon. @NAMB_SBC National Ambassador. 62nd President of the SBC. Rom 1:16",https://twitter.com/jdgreear,"Raleigh,NC",http://jdgreear.com/resources/books/
855,grcastleberry,"Awakened to a holy God. Sr Pastor @capcommchurch in Raleigh, NC. Husband & Father. U.S. Marine. President @truth_unashamed. Contributor @forthegospelmin.",https://twitter.com/grcastleberry,"Raleigh,NC",http://unashamedtruth.org
856,kennymxu,"President, @CUU_org | Author, podcaster ""Inconvenient Minority,"" order here: amzn.to/3hWXisw | Rom. 12:2",https://twitter.com/kennymxu,"Raleigh,NC",http://colorusunited.org
857,MarkRein,Vice President and Co-Founder of Epic Games. Carolina Hurricanes fan.,https://twitter.com/MarkRein,"Raleigh,NC",http://www.epicgames.com
858,RevDrBarber,"President @BRepairers, co-chair @unitethepoor, architect of #MoralMondays, Founding Director and Professor at Yale @theology_policy. Join us: Text ROTB to 32846",https://twitter.com/RevDrBarber,"Raleigh,NC",https://www.breachrepairers.org
859,C_Rice1,President at @KauligRacing | Living everyday like it's the last! | Proud Husband and Father!,https://twitter.com/C_Rice1,"Raleigh,NC",http://www.kauligracing.com
860,_JonWood,Washed up NASCAR driver | Senior Vice President and Stakeholder at Wood Brothers Racing,https://twitter.com/_JonWood,"Raleigh,NC",http://www.woodbrothersracing.com
861,MyNCSenate,NC Republican Senate Caucus: 30 Senators working for the people of North Carolina.,https://twitter.com/MyNCSenate,"Raleigh,NC",http://ncstatesenate.com
862,Ojeda4America,"Retired US Army, Former WV State Senator. Host of Ojeda Live, the hit nightly Facebook & YouTube live show.",https://twitter.com/Ojeda4America,"Raleigh,NC",https://www.youtube.com/@ojedalive898
863,EricaforUS,"Three-term NC state senator, candidate for NC-01, engineer, clergywoman, educator, mother of 4. People, not PACs.",https://twitter.com/EricaforUS,"Raleigh,NC",http://www.ericaforus.com
864,PletchaPJWebb,"Award Winning, Amazon International Bestselling Indie Author of The Prince of the Blood Vampire Chronicles, and Lora Lee from the Cliff House Series",https://twitter.com/PletchaPJWebb,"Raleigh,NC",http://amzn.to/2aiNpay
865,NancyMacLean5,Award-winning historian of US social movements and politics @DukeU. Board member @EXPOSEDbyCMD. Author NYT bestseller #DemocracyinChains. Opinions & dog my own.,https://twitter.com/NancyMacLean5,"Raleigh,NC",http://amzn.to/3aBg21D
866,W_E_F3,"The Official Twitter Presence for author

 William Fripp",https://twitter.com/W_E_F3,"Raleigh,NC",http://about.me/william.fripp.3
867,mikebeckhamsm,"Co-Founder and CEO of Simple Modern. 

Follow me to learn about entrepreneurship, building a consumer brand, cultivating healthy culture, and purposeful living.",https://twitter.com/mikebeckhamsm,"Oklahoma,OK",http://scalingforgood.com
868,danielpmaloney,"CEO, co-founder of @TailwindApp, the #AI driven marketing platform trusted by over 1 million brands worldwide. Alum: @google, @YouTube, @AOL, @Penn",https://twitter.com/danielpmaloney,"Oklahoma,OK",https://www.tailwindapp.com/
869,kimkimberling,"Christian Counselor, CEO of Awesome Marriage, speaker, teacher, and author.",https://twitter.com/kimkimberling,"Oklahoma,OK",http://www.awesomemarriage.com
870,ScottWilliams,"Success Coach || Keynote Speaker || Author || CEO @1OklahomaNIL || #1Oklahoma ☝️ || Life Mission = HOW ""HelpingOthersWin!"" RT ≠ Endorsement",https://twitter.com/ScottWilliams,"Oklahoma,OK",https://www.1oklahoma.com/
871,JillCastilla,"Here to help. President & CEO @CitizensEdmond, Trustee @hpu @swgsb, OK @CASA_Army, Army & Navy mom, veteran. Views=Mine",https://twitter.com/JillCastilla,"Oklahoma,OK",https://www.linkedin.com/in/jillcastilla
872,JakeRyanTweet,"Founder and CMO: @GenzioCo, Creator, Engaged, Marketer.",https://twitter.com/JakeRyanTweet,"Oklahoma,OK",http://www.genzio.co
873,Barry_Switzer,Former head coach of OU Sooners & Dallas Cowboys. Founder of @CoachesCabana & Switzer Family Vineyards @SwitzerVineyard switzerfamilyvineyards.com,https://twitter.com/Barry_Switzer,"Oklahoma,OK",http://www.coachescabana.com
874,LChamberlain44,"Commissioner @wprofastpitch. Youth Ambassador @mlb. Founder @lcmgmtgroup. Alum @ou_softball. Lover of family, friends and simple things",https://twitter.com/LChamberlain44,"Oklahoma,OK",http://www.wprofastpitch.com
875,MomSpark,"Founder of Mom Spark. Mom. Content Creator. Award-Winning Writer & Blogger. Featured in Real Simple, CNN, & Huff Post. @Zulily Contributor. OKC.",https://twitter.com/MomSpark,"Oklahoma,OK",https://MomSpark.net
876,HypeSir7,"Spreading Joy, Changing Lives one story at a time. Co- Founder Share The King  | Author of Start Where You Are",https://twitter.com/HypeSir7,"Oklahoma,OK",https://beacons.ai/rashawncopeland
877,MiguelChavis65,"Disciple of Jesus Christ. Husband to @megmchavis. Daddy to 4 awesome kiddos. Servant-Leader of THE EDGEMEN, the Defensive Ends/Outside LBs Group @OU_Football",https://twitter.com/MiguelChavis65,"Oklahoma,OK",
878,EmilyVirginOK,Director of Advocacy & Government Relations at Human Rights for Kids @HRFK_ORG. Proud Aunt. Former OK State Rep & Minority Leader. Boomer Sooner! She/Her,https://twitter.com/EmilyVirginOK,"Oklahoma,OK",
879,BigChiefOKC,"Big Chief from Discovery Channel's Street Outlaws. The Race Master! Professional street racer and semi pro idiot!!

instagram and snapchat @bigchiefokc",https://twitter.com/BigChiefOKC,"Oklahoma,OK",http://midweststreetcars.com
880,choctawnationOK,The Choctaw Nation of Oklahoma is the third-largest federally recognized tribe in the United States. Gary Batton Chief and Jack Austin Jr. Assistant Chief.,https://twitter.com/choctawnationOK,"Oklahoma,OK",http://www.choctawnation.com
881,KOCOdamonlane,Chief Meteorologist KOCO(OKC).CBM Seal #531. Emmy Winner and AP Oklahoma Best Weathercast. Old Dominion University & University of North Carolina @ Asheville,https://twitter.com/KOCOdamonlane,"Oklahoma,OK",http://www.koco.com/
882,tornadopayne,KWTV News 9 Chief Meteorologist...love my family first..weather second.,https://twitter.com/tornadopayne,"Oklahoma,OK",http://news9.com
883,MikeMorganKFOR,"Chief Met. KFOR-TV OKC. 7 Reg/Nat’l Emmy's. Best OK. Wxcast 12X, 7th Gen. OK. Kids, TOR Tracker 1974, AMS Seal. Marla, Sinatra, Marla insta: mikemarlamorgan",https://twitter.com/MikeMorganKFOR,"Oklahoma,OK",
884,KOCOMichael,Emmy & Edward R. Murrow Award Winning Field Meteorologist/Executive Weather Producer for KOCO5 in OKC. AMS CBM Seal #835,https://twitter.com/KOCOMichael,"Oklahoma,OK",http://www.koco.com
885,najournalists,Empowering a unique network of members and #journalists covering #TurtleIsland.,https://twitter.com/najournalists,"Oklahoma,OK",http://www.naja.com
886,SvrWxChaser,"Storm chaser & freelance journalist of natural disasters since '04.
Seen both a Cat5 hurricane & 2 EF5 tornadoes.
Trans-lesbian. She/her. Goth. BLM! ✊ 🖤",https://twitter.com/SvrWxChaser,"Oklahoma,OK",http://www.chimeracomstock.com/
887,abbybroyles,Attorney. Former investigative journalist. 2020 Democratic nominee for US Senate. Lifelong Oklahoman.,https://twitter.com/abbybroyles,"Oklahoma,OK",https://www.abbybroyles.com
888,KOCOAbigail,"Award-winning journalist. Oklahoma. Family. Breaking news. Sports. ""The best competition I have is against myself to become better."" -John Wooden",https://twitter.com/KOCOAbigail,"Oklahoma,OK",http://facebook.com/AbigailOgle
889,DirkHooper,"Award-Winning Fetish Photographer, Writer & Artist, Adult Marketing & Branding Consultant, Podcast Producer and Host, Kink Journalist and BDSM Mentor.",https://twitter.com/DirkHooper,"Oklahoma,OK",http://www.dirkhooper.com
890,grahambrewer,"Covering Indigenous communities and tribal nations for @NBCNews. ᏣᎳᎩ, @najournalists vice-president.",https://twitter.com/grahambrewer,"Oklahoma,OK",
891,brianmills247,Married to @jennifermills921 | Dad | Senior Pastor @TrinityChurchOK | Speaker | Author | Latest Book “A Different College Experience”,https://twitter.com/brianmills247,"Oklahoma,OK",http://www.trinitychurchok.com
892,benfelder_okc,"I cover state government for The Oklahoman 🗞. Author of Political Winds newsletter, sign up at profile.oklahoman.com/newsletters/po…",https://twitter.com/benfelder_okc,"Oklahoma,OK",https://www.oklahoman.com/staff/8770470002/ben-felder/
893,MickCornett,Husband. Father x3. Grandfather x9. Author of “The Next American City” Mayor of OKC (2004-2018),https://twitter.com/MickCornett,"Oklahoma,OK",http://www.thenextamericancity.com
894,stevelackmeyer,"OKC reporter, columnist and history author. Follow me on ALTERNATIVE SOCIAL MEDIA ACCOUNT CENSORED",https://twitter.com/stevelackmeyer,"Oklahoma,OK",https://about.me/stevelackmeyer
895,KevinDeShazo,"Co-founder of @bebetterleaders. Keynote speaker, consultant for top leaders/teams on leadership, culture, mindset, high performance. Author of 3 books. More👇🏼",https://twitter.com/KevinDeShazo,"Oklahoma,OK",https://msha.ke/kevindeshazo/
896,BLesTheMic,God 1st / I rap a lil bit/ Serve my community / #OkState Gameday Emcee @LesGoPokes /Best Selling Author/TEDX Speaker/ Hope Culture Inc.,https://twitter.com/BLesTheMic,"Oklahoma,OK",https://youtu.be/dmn9xLV7Ig4
897,RoyAtkinson,"Business Advisor | Industry Analyst | Writer | CEO | Speaker 
who tweets about customer focus (#custserv #cx); #ITSM, #IT and #tech - Tweets are my own.",https://twitter.com/RoyAtkinson,"Columbia,SC",https://cliftonbutterfield.com
898,thepespecialist,"#PhysEd Teacher, Dad, Husband, #PEgeek , Adventure Seeker + Life Lover. Founder of thePEspecialist.com 👊🏻👍🏻 2019 SC Elem PE TOY",https://twitter.com/thepespecialist,"Columbia,SC",https://linktr.ee/thepespecialist
899,paulafaris,"🤍Mama, wife, Jesus 🤎 FOUNDER: 🙋🏽‍♀️CarryMedia.com AUTHOR📗: Called Out PODCAST 🎧: “Faith & Calling”. PAST LIFE 📺: GMA,The View",https://twitter.com/paulafaris,"Columbia,SC",https://podcasts.apple.com/us/podcast/the-paula-faris-podcast/id1550996910?i=1000506781316
900,1075thegame,"Columbia, South Carolina's Sports Leader. Gamecock game stream is limited to 75-mile Columbia radius per Learfield/IMG -- a Cumulus Media station",https://twitter.com/1075thegame,"Columbia,SC",http://www.1075thegame.com
901,ghost_0836,"Just livin my dream and trying be a good father for my kids NaTyia Parker ,Keyshawn Parker & Asher Parker God bless!! #Retired Kansas City Chiefs #big🎱",https://twitter.com/ghost_0836,"Columbia,SC",
902,K_Law124,Director (Chief) of The Winnsboro Dept. of Public Safety Email:KLawrence@winnsborodps.sc.gov #Redskins #Wizards #SC2DC #AikenCountyNative,https://twitter.com/K_Law124,"Columbia,SC",http://www.rcsd.net
903,AveryGWilks,"South Carolinian. Storyteller. Gamecock. Two-time SC Journalist of the Year. Murdaugh Megathread guy. Alum @postandcourier, @thestate. @UofSC Honors College ‘15",https://twitter.com/AveryGWilks,"Columbia,SC",
904,TheStefanSmith,"Deputy Chief Digital Engagement Officer @ACLU | former digital for @PeteButtigieg | @drunkhistory, @hfa, @nmdems alum | opinions mine | he/him",https://twitter.com/TheStefanSmith,"Columbia,SC",https://post.news/article/2J6DEIn6NhfXIvFIKoFwI0rzOFZ
905,CharlesBloomSC,"Executive Associate AD at University of South Carolina Athletics. Tweets are my viewpoints. Former SECPRGuy. For official UofSC news, follow @GamecocksOnline.",https://twitter.com/CharlesBloomSC,"Columbia,SC",http://www.gamecocksonline.com
906,AdairFromSC,"U.S. Attorney for the District of South Carolina. Personal Account. For official updates follow @USAO_SC.  Mom. Former Teacher, Non-profit Executive Director.",https://twitter.com/AdairFromSC,"Columbia,SC",
907,ryan_buell,"Paranormal Investigator (host of A&E's Paranormal State), author, journalist,wizard, future counselor! Penn State and UofSC. 👻🏳️‍🌈",https://twitter.com/ryan_buell,"Columbia,SC",http://www.ryanbuell.org
908,AndreaMockSC,"News19 This Morning & Friends @5 Anchor, EMMY Award winning journalist @WLTX #CBS. MomChef, History buff, Disney Nerd. But most importantly, Brady's mom.",https://twitter.com/AndreaMockSC,"Columbia,SC",http://www.WLTX.com
909,HarrisPastides,President Emeritus of @UofSC. Cheering and pulling for the Gamecocks and everything Carolina wherever I might be.,https://twitter.com/HarrisPastides,"Columbia,SC",http://sc.edu
910,MiloniTime,He/Him丨Master Gamer丨Entertainer丨Future president of the united states丨 @Virtuaspirits streamer on hiatus丨PFP by @ihannavi,https://twitter.com/MiloniTime,"Columbia,SC",http://twitch.tv/miloni
911,AuthorKMoran,International bestselling/award-winning author of enchanting ever-afters.❤️ My horror persona= @kellycovic 👀 NOH8. Follow: linktr.ee/AuthorKellyMor… xo,https://twitter.com/AuthorKMoran,"Columbia,SC",http://www.authorkellymoran.com
912,johnmediana,🎥 I make short form videos for CEOs | 🚀 Small Agency Big Impact | ▶️ Run YouTube Channels | 📸 I’ve helped 250+ CEOs create & monetize content | 3x Founder,https://twitter.com/johnmediana,"Nashville,TN",https://www.ExecutiveBrandGrowth.com
913,TreyTri,CEO @VastGG | Halo Coach @Nativegaming | @OXG_Esports | Co-Founder @DrinkPoggers | Air Force National Guard 🇺🇸,https://twitter.com/TreyTri,"Nashville,TN",
914,JamesEKHildreth,"President and CEO, Professor of Internal Medicine, Meharry Medical College, HIV researcher",https://twitter.com/JamesEKHildreth,"Nashville,TN",http://mmc.edu
915,ShaneMac,"Co-founder & CEO of XMTP Labs, building @XMTP_, Founder @Logos_Labs, Co-founder @GoSquaredAway.",https://twitter.com/ShaneMac,"Nashville,TN",http://shanemac.com/
916,aboehler,"CEO Rubicon Founders. Fmr CEO, U.S. International Development Finance Corporation, Fmr Director CMMI & Deputy Administrator CMS, fmr CEO Landmark Health",https://twitter.com/aboehler,"Nashville,TN",http://rubiconfounders.com
917,Joshua_Swanson,Husband to Rachael Joy. Dog dad to Eden. CEO of @gtma_agency and Authentic Media. Partner and podcast host at @Worshipleader.,https://twitter.com/Joshua_Swanson,"Nashville,TN",https://authenticmedia.company/
918,WilliamWHomes,"▸Nashville TN Real Estate Broker/ Founder, CEO of William Wilson Homes ,LLC. ▸ Co- Owner of Cinema Anywhere Nashville #ForeverScoob",https://twitter.com/WilliamWHomes,"Nashville,TN",http://www.WilliamWilsonHomes.Com
919,McQueenCandice,Wife. Mom to two. President @Lipscomb. Former TN Commissioner of Education and CEO @NIETteach. Love our students and educators. Proud Tennessean! 2 Timothy 1:7,https://twitter.com/McQueenCandice,"Nashville,TN",http://lipscomb.edu
920,LeonHWolf,"Managing Editor, theblaze.com. Occasional talking head on cable news. President and CEO of Big Spider.",https://twitter.com/LeonHWolf,"Nashville,TN",http://www.theblaze.com
921,ShannonTerry,"Founder and CEO of On3.com.

Founder 247Sports (acq by CBS), Rivals (acq by Yahoo!) & Pop Culture Media (acq CBSi)",https://twitter.com/ShannonTerry,"Nashville,TN",http://on3.com
922,AndyPuzder,"Husband, father, former CEO. Senior Fellow, Pepperdine U & AFPI, visiting fellow at the Heritage Foundation. Author “The Capitalist Comeback” order on Amazon",https://twitter.com/AndyPuzder,"Nashville,TN",http://andy.puzder.com
923,itsdougthepug,"KING OF POP CULTURE, Founder of @DTPfoundation, 2x People’s Choice Award Winner 🍕Plays Monchi in @mitchellsmovie! New book out now.",https://twitter.com/itsdougthepug,"Nashville,TN",http://www.dougthepug.com
924,Bridge_FIT,Health Coach & Founder of Halfway Hippie | Wife to a pretty cool rapper | IG @Bridge_Fit,https://twitter.com/Bridge_FIT,"Nashville,TN",http://halfway-hippie.com
925,johnrich,1/2 of @bigandrich Founder of @redneckriviera Whiskey @oldglorybank @rnrbarnash I support @foldsofhonor @stjude Redneckriviera.com,https://twitter.com/johnrich,"Nashville,TN",http://www.REDNECKRIVIERA.COM
926,kaitlynbristowe,"Former Bachelorette, Podcast Host #OffTheVine DWTS winner💃 Insta- @kaitlynbristowe founder of @spadeandsparrows @dewedit Bookings - media@kaitlynbristowe.com",https://twitter.com/kaitlynbristowe,"Nashville,TN",http://www.kaitlynbristowe.com
927,JoshJDurham,"Founder @AlignedGrowth, | Influencer MGMT for DTC Brands | Previously 7 figure brand owner | Believer | #Forbes30under30",https://twitter.com/JoshJDurham,"Nashville,TN",http://Alignedgrowthmanagement.com
928,plumbmusic,"Artist, Author and Advocate
Founder of the HOPEHOUSE (non profit)
Booking: jeffroberts.com 615-859-7040",https://twitter.com/plumbmusic,"Nashville,TN",
929,MorganOrtagus,"Proud Jewish Mama & Wife | Founder @polarisnatsec |Former: @StateDept Spox, @USTreasury @usaid “I was born for the storm, and a calm does not suit me.”",https://twitter.com/MorganOrtagus,"Nashville,TN",http://morganortagus.com
930,bfrist,"Fmr U.S. Senate Majority Leader, Heart Transplant Surgeon, Weekly Podcaster @ASOpodcast, NashvilleHealth Founder @nashhealthorg, Builder of Healthcare Companies",https://twitter.com/bfrist,"Nashville,TN",http://www.billfrist.com
931,NealSchonMusic,JOURNEY Founder/Santana/Bad English/HSAS/Hall of Famer @RockHall of Fame @Grammy Hall of Fame/ Oklahoma music Hall of Fame Over 1 Billion streams DSB,https://twitter.com/NealSchonMusic,"Nashville,TN",http://NealSchonCollection.Com
932,MelissaOnline,Founder @sheownsitco #Nashville. Purveyor of Possibility. Mindset + Business Coach. #Entrepreneur Encourager. #Coffee Enabler. Just. Get. Started.,https://twitter.com/MelissaOnline,"Nashville,TN",http://www.SheOwnsIt.com
933,nancyalcorn,"Founder & President of @MercyMultiplied, 
International Speaker and Author",https://twitter.com/nancyalcorn,"Nashville,TN",https://linktr.ee/nancyalcorn
934,Adam_K_Levin,"Consumer advocate. “What the Hack with Adam Levin” podcast. Author of Swiped. Co-founder Credit.com, and founder @CyberScout",https://twitter.com/Adam_K_Levin,"Nashville,TN",https://adamlevin.com
935,drjoshaxe,Transforming health with superfoods  | Founder of draxe.com | co-founder of @ancientnutr | best-selling book Ancient Remedies #draxe,https://twitter.com/drjoshaxe,"Nashville,TN",http://draxe.com/?utm_campaign=bio&utm_medium=social&utm_source=twitter&utm_content=draxe
936,CryptoBrodyLLC,Content creator in the making | Dms are open📥 | Founder/Owner @notigangnft/@bellstudios3 | OG Mod @degencoinflip/@degenfatcats | Ambassador @Trust_Labs_,https://twitter.com/CryptoBrodyLLC,"Nashville,TN",https://oak.bet/?ref=bell
937,bradytoops,🎶 Musician | 📲Podcaster | ⚾️ Former Pro Baseball Player | ✨Founder of Soul Games soul.games,https://twitter.com/bradytoops,"Nashville,TN",https://bradytoops.com
938,RStanleyNHL,Host of Robby and Rexrode on @1025TheGame. Have covered the Preds since 2011. Founder of The Unshakable Foundation. Matthew 6:25-34,https://twitter.com/RStanleyNHL,"Nashville,TN",http://theunshakablefoundation.com
939,brittneymkelley,🤠co-founder @chillcowboycc x NFT collection minting June 30 2022 // ethical designer @tribekelley // entrepreneur // mental health advocate,https://twitter.com/brittneymkelley,"Nashville,TN",https://chillcowboy.com
940,DesmondChild,Hitmaker To The Stars | Grammy-Winning Producer | Songwriters Hall of Fame | ASCAP Board | Latin Songwriters Hall Of Fame Founder | @dchildandrouge,https://twitter.com/DesmondChild,"Nashville,TN",http://desmondchild.com
941,JosephWalker3,Husband | Father | Presiding Bishop @FGBCF | Senior Pastor @mtzionnashville | Philanthropist | HBCU Board Chair | Author x 13 | Next Level Leader Podcast,https://twitter.com/JosephWalker3,"Nashville,TN",http://www.josephwalker3.org
942,scottythom,"Jesus Follower. Husband. Father. Grandfather. Church Planting Partners. Author: Gospel Coach, The Gospel Shaped Leader.",https://twitter.com/scottythom,"Nashville,TN",http://www.gospelleader.com
943,cottrelltravis,Child of God | Husband | Dad | Brother | Friend | Worship Leader for Beth Moore/Living Proof Live | Songwriter | Musician | Pastor,https://twitter.com/cottrelltravis,"Nashville,TN",http://traviscottrell.com/
944,ChrisSligh,hit songwriter // producer // husband // dad // former artist // former church leader // former evangelical // enemy of Christofascists,https://twitter.com/ChrisSligh,"Nashville,TN",http://chrissligh.org
945,NikiLattarulo,"Sports Reporter at @WSMV || Proud Jersey girl livin in Nashville || I like to type in CAPS & tweet excessively about the Yankees, Chiefs & my dog Gino",https://twitter.com/NikiLattarulo,"Nashville,TN",https://youtu.be/h1elS9wmYrM
946,drmoore,"Editor in Chief, @CTmagazine; author, Losing Our Religion: An Altar Call for Evangelical America (coming this August)",https://twitter.com/drmoore,"Nashville,TN",http://www.russellmoore.com
947,BldCancerDoc,Physician-in-Chief of Blood Cancers @SarahCannonDocs @HCAhealthcare | President @ASTCT 2019 | #BMTsm #CARTcell #CellTherapy,https://twitter.com/BldCancerDoc,"Nashville,TN",https://sarahcannon.com/
948,WylieNewmark,"cyber(punk) threat intel. ""shape, not deter."" counterintelligence, Russia, Iran, Dune, Robert Ritter, Beff Horn. #FUZZYSNUGGLYDUCK-in-chief. opinions are my own",https://twitter.com/WylieNewmark,"Nashville,TN",https://infosec.exchange/@wylienewmark
949,LisaSpencerWSMV,"@WSMV Chief Meteorologist, PB Author, CBM and NWA sealed, Emmy winning, wife, mom and dog lover. Blessed beyond measure.",https://twitter.com/LisaSpencerWSMV,"Nashville,TN",http://lisaspencer.com/
950,NC5PhilWilliams,"Speaking truth to power - and the angry mob. @NC5 chief investigative reporter. duPont, Peabody awards. Pulitzer finalist. TIPS: phil.williams@newschannel5.com",https://twitter.com/NC5PhilWilliams,"Nashville,TN",http://www.newschannel5.com
951,DanielleBreezy,@WKRN Chief Meteorologist! CBM sealed & Edward R. Murrow Award winner!  @Cornell grad! Married to @JoeBreezyRadio. I love all things sports! RTs ≠ endorsements,https://twitter.com/DanielleBreezy,"Nashville,TN",https://daniellebreezytv.com/
952,MarcLobliner,"Outright Bar Creator, TigerFitness.com Chief Marketing Officer, MTS Nutrition Owner, Ambrosia Partner, IFBB Pro Bodybuilder, Husband and Father",https://twitter.com/MarcLobliner,"Nashville,TN",http://www.tigerfitness.com
953,3HL1045,Weekdays 3-6pm central on @1045thezone in Nashville - @BrentDougherty @DawnDavenportTN and @TheRonSlay . 3HL Executive Producer: @JoeHunk.,https://twitter.com/3HL1045,"Nashville,TN",http://1045thezone.com
954,EJGaines,"Christian. Husband. Father. Attorney. Music Executive at Capitol CMG & Motown Gospel. Views are my own, memes are not.",https://twitter.com/EJGaines,"Nashville,TN",http://www.ejgaines.com
955,MillerBudMusic,"Singer, songwriter, record producer and executive music producer for ABC TV hit show NASHVILLE.  Is nice to doggies & kitties, too!",https://twitter.com/MillerBudMusic,"Nashville,TN",http://BuddyMiller.com
956,RAntoshak,"Experienced Global Executive. Consults to the cotton, textile, and apparel industries. Columnist and industry analyst.",https://twitter.com/RAntoshak,"Nashville,TN",http://fromfieldtoshelf.com
957,DrewMaddux,"Pick Up the Trash-Seeking to Leave People, Places and Things better than we found them! Executive Vice President, People Development-Dufresne Spencer Group, LLC",https://twitter.com/DrewMaddux,"Nashville,TN",http://www.coachdrewmaddux.com
